{
  "run_id": "run_groupby_wrapper_blocked_baseline_v1",
  "generated_at": "2026-04-07T07:45:57.140333+00:00",
  "status": "DONE",
  "verdict": "PASS",
  "next_action": "inspect",
  "phase_status": {
    "preflight": "DONE",
    "scan": "DONE",
    "optimize": "DONE",
    "validate": "DONE",
    "patch_generate": "DONE",
    "report": "DONE"
  }
}
