{
  "run_id": "run_f0237be1220c",
  "generated_at": "2026-04-07T09:37:12.797583+00:00",
  "status": "DONE",
  "verdict": "PASS",
  "next_action": "apply",
  "phase_status": {
    "preflight": "DONE",
    "scan": "DONE",
    "optimize": "DONE",
    "validate": "DONE",
    "patch_generate": "DONE",
    "report": "DONE"
  }
}
