{
  "run_id": "run_orderby_family_v1",
  "generated_at": "2026-04-07T09:23:09.793936+00:00",
  "status": "DONE",
  "verdict": "PARTIAL",
  "next_action": "inspect",
  "phase_status": {
    "preflight": "DONE",
    "scan": "DONE",
    "optimize": "DONE",
    "validate": "DONE",
    "patch_generate": "DONE",
    "report": "DONE"
  }
}
